{
  "schemaVersion": "cp.release-transition-decision.v1",
  "releaseId": "cp-signature-hoodie-2026-001",
  "fromState": "draft",
  "targetState": "staged",
  "allowed": false,
  "blockers": [
    {
      "code": "SHOPIFY_VARIANT_FINGERPRINT_MISSING",
      "humanAction": "An authorized read-only Shopify observer records and fingerprints the exact candidate variants.",
      "resumePoint": "Update the Draft Product Release Record with the sanitized Shopify variant fingerprint, then re-evaluate staging."
    },
    {
      "code": "SHOPIFY_COMMERCE_FACTS_REVIEW_MISSING",
      "humanAction": "The Product Owner or named designee reviews the canonical product, price, availability, and variant facts.",
      "resumePoint": "Apply the accepted commerce-facts fingerprint to the Draft Product Release Record under separate authorization, then re-evaluate staging."
    },
    {
      "code": "SHOPIFY_PRODUCT_OBSERVATION_REVIEW_MISSING",
      "humanAction": "The Product Owner or named designee reviews the exact sanitized Shopify observation envelope.",
      "resumePoint": "Apply the accepted candidate observation fingerprint and durable review evidence to the Draft Product Release Record under separate authorization, then re-evaluate staging."
    },
    {
      "code": "FULFILLMENT_VARIANT_FINGERPRINT_MISSING",
      "humanAction": "An authorized provider observer verifies every fulfillment variant mapping.",
      "resumePoint": "Record sanitized provider variant fingerprints for every mapping, then re-evaluate staging."
    },
    {
      "code": "CANDIDATE_COMMIT_MISSING",
      "humanAction": "Select an immutable candidate commit without merging or deploying it.",
      "resumePoint": "Record the candidate Git commit in the Product Release Record, then re-evaluate staging."
    },
    {
      "code": "BUILD_EVIDENCE_MISSING",
      "humanAction": "Run the approved local quality/build gate for the immutable candidate.",
      "resumePoint": "Bind the passing machine-readable build evidence to the candidate, then re-evaluate staging."
    },
    {
      "code": "STAGING_EVIDENCE_MISSING",
      "humanAction": "Restore or select an authorized private staging surface and verify the candidate.",
      "resumePoint": "Bind desktop/mobile staging evidence without promoting production, then re-evaluate staging."
    }
  ],
  "candidate": null
}
